Index,Questions,Answers
1,What is Python?,"Python is a high-level, interpreted, general-purpose programming language. Being a general-purpose language, it can be used to build almost any type of application with the right tools/libraries. Additionally, python supports objects, modules, threads, exception-handling, and automatic memory management which help in modeling real-world problems and building applications to solve these problems"
2,What is the difference between a list and a tuple?,1. A list consists of mutable objects. (Objects which can be changed after creation) 2.A tuple consists of immutable objects. (Objects which cannot change after creation)
3,What are the benefits of using Python?,"Python is a general-purpose programming language that has a simple, easy-to-learn syntax that emphasizes readability and therefore reduces the cost of program maintenance. Moreover, the language is capable of scripting, is completely open-source, and supports third-party packages encouraging modularity and code reuse. Its high-level data structures, combined with dynamic typing and dynamic binding, attract a huge community of developers for Rapid Application Development and deployment"
4,What is a dynamically typed language?,"Dynamic - Data Types are checked during execution. Python is an interpreted language, executes each statement line by line and thus type-checking is done on the fly, during execution. Hence, Python is a Dynamically Typed Language."
5,What is an Interpreted language?,"An Interpreted language executes its statements line by line. Languages such as Python, Javascript, R, PHP, and Ruby are prime examples of Interpreted languages. Programs written in an interpreted language runs directly from the source code, with no intermediary compilation step"
6,What is PEP 8 and why is it important?,"PEP stands for Python Enhancement Proposal. A PEP is an official design document providing information to the Python community, or describing a new feature for Python or its processes. PEP 8 is especially important since it documents the style guidelines for Python Code. Apparently contributing to the Python open-source community requires you to follow these style guidelines sincerely and strictly."
7,What are lists and tuples?,"Lists and Tuples are both sequence data types that can store a collection of objects in Python. The objects stored in both sequences can have different data types. Lists are represented with square brackets ['sara', 6, 0.19], while tuples are represented with parantheses ('ansh', 5, 0.97)."
8,What is self in Python?,"Self is a keyword in Python used to define an instance of an object of a class. In Python, it is explicitly used as the first parameter, unlike in Java where it is optional. It helps in distinguishing between the methods and attributes of a class from its local variables."
9,What is __init__?,__init__ is a contructor method in Python and is automatically called to allocate memory when a new object/instance is created.The method is run as soon as an object is instantiated. It is useful for initializing any attributes or default behaviour of the object at the time of instantiation.
10,"What is break, continue and pass in Python?","Break : The break statement terminates the loop immediately and the control flows to the statement after the body of the loop.Continue :The continue statement terminates the current iteration of the statement, skips the rest of the code in the current iteration and the control flows to the next iteration of the loop. Pass  : The pass keyword in Python is generally used to fill up empty blocks and is similar to an empty statement represented by a semi-colon in languages such as Java, C++, Javascript, etc."
11,What is docstring in Python?,Documentation string or docstring is a multiline string used to document a specific code segment. The docstring should describe what the function or method does.
12,What is the difference between Python Arrays and lists?,"Arrays in python can only contain elements of same data types i.e., data type of array should be homogeneous. It is a thin wrapper around C language arrays and consumes far less memory than lists . Lists in python can contain elements of different data types i.e., data type of lists can be heterogeneous. It has the disadvantage of consuming large memory"
13,What are decorators in Python?,Decorators in Python are essentially functions that add functionality to an existing function in Python without changing the structure of the function itself. They are represented the @decorator_name in Python and are called in a bottom-up fashion
14,What is lambda in Python? Why is it used?,"Lambda is an anonymous function in Python, that can accept any number of arguments, but can only have a single expression. It is generally used in situations requiring an anonymous function for a short time period"
15,What are generators in Python?,"Generators are functions that return an iterable collection of items, one at a time, in a set manner. Generators, in general, are used to create iterators with a different approach. They employ the use of yield keyword rather than return to return a generator object."
16,Explain split() and join() functions in Python?,You can use split() function to split a string based on a delimiter to a list of strings . You can use join() function to join a list of strings based on a delimiter to give a single string
17,What does *args and **kwargs mean,*args is a special syntax used in the function definition to pass variable-length arguments . **kwargs is a special syntax used in the function definition to pass variable-length keyworded arguments.
18,What are negative indexes and why are they used?,Negative indexes are the indexes from the end of the list or tuple or string . Arr[-1] means the last element of array Arr[]
19,How do you create a class in Python?,"To create a class in python, we use the keyword class"
20,How does inheritance work in python?,Inheritance gives the power to a class to access all attributes and methods of another class. It aids in code reusability and helps the developer to maintain applications without redundant code. The class inheriting from another class is a child class or also called a derived class. The class from which a child class derives the members are called parent class or superclass.
21,Are access specifiers used in python?,"Python does not make use of access specifiers specifically like private, public, protected, etc. However, it does not deprive this to any variables. It has the concept of imitating the behaviour of variables by making use of a single (protected) or double underscore (private) as prefixed to the variable names. By default, the variables without prefixed underscores are public."
22,Is it possible to call parent class without its instance creation?,"Yes, it is possible if the base class is instantiated by other child classes or if the base class is a static method."
23,How is an empty class created in python?,An empty class does not have any members defined in it. It is created by using the pass keyword (the pass command does nothing in python). We can create objects for this class outside the clas
24,Differentiate between new and override modifiers.,The new modifier is used to instruct the compiler to use the new implementation and not the base class function. The Override modifier is useful for overriding a base class function inside the child class.
25,How will you check if a class is a child of another class?,This is done by using a method called issubclass() provided by python. The method tells us if any class is a child of another class by returning true or false accordingly.
26,What do you know about pandas?,"Pandas is an open-source, python-based library used in data manipulation applications requiring high performance. The name is derived from “Panel Data” having multidimensional data. This was developed in 2008 by Wes McKinney and was developed for data analysis"
27,Define pandas dataframe.,A dataframe is a 2D mutable and tabular structure for representing data labelled with axes - rows and columns.
28,Differentiate between a package and a module in python.,"The module is a single python file. A module can import other modules as objects. Whereas, a package is the folder/directory where different sub-packages and the modules reside"
29,What is monkey patching in Python?,"In Python, the term monkey patch only refers to dynamic modifications of a class or module at run-time."
30,"What is Polymorphism in Python?","Polymorphism means the ability to take multiple forms. So, for instance, if the parent class has a method named ABC then the child class also can have a method with the same name ABC having its own parameters and variables. Python allows polymorphism."
31,What is data structure?,"A data structure is a way of organizing data that considers not only the items stored, but also their relationship to each other. Advance knowledge about the relationship between data items allows designing of efficient algorithms for the manipulation of data."
32,What are minimum number of queues needed to implement the priority queue?,Two. One queue is used for actual storing of data and another for storing priorities.
33,What is the data structures used to perform recursion?,"Stack. Because of its LIFO Last In First Out property it remembers its caller so knows whom to return when the function has to return . Recursion makes use of system stack for storing the return addresses of the function calls . Every recursive function has its equivalent iterative non-recursive function. Even when such equivalent iterative procedures are written, explicit stack is to be used."
34,What are the notations used in Evaluation of Arithmetic Expressions using prefix and postfix forms?,Polish and Reverse Polish notations.
35,"Sorting is not possible by using which of the following methods? (Insertion, Selection, Exchange, Deletion)","Sorting is not possible in Deletion. Using insertion we can perform insertion sort, using selection we can perform selection sort, using exchange we can perform the bubble sort (and other similar sorting methods). But no sorting method can be done just using deletion."
36,What are the methods available in storing sequential files ?,"Straight merging, Natural merging, Polyphase sort, Distribution of Initial runs."
37,List out few of the Application of tree data-structure?,"The manipulation of Arithmetic expression, Symbol Table construction, Syntax analysis"
38,In tree construction which is the suitable efficient data structure?,"Array, Linked list, Stack, Queue Linked list is the suitable efficient data structure."
39,What is the type of the algorithm used in solving the 8 Queens problem?,Backtracking
40,"In an AVL tree, at what condition the balancing is to be done?",If the pivotal value or the Height factor is greater than 1 or less than -1.
41,"What is the bucket size, when the overlapping and collision occur at same time?","One. If there is only one entry possible in the bucket, when the collision occurs, there is no way to accommodate the colliding value. This results in the overlapping of values."
42,"In RDBMS, what is the efficient data structure used in the internal storage representation?","B+ tree. Because in B+ tree, all the data is stored only in leaf nodes, that makes searching easier. This corresponds to the records that shall be stored in leaf nodes."
43,What is a spanning Tree?,A spanning tree is a tree associated with a network. All the nodes of the graph appear on the tree once. A minimum spanning tree is a spanning tree organized so that the total edge weight between nodes is minimized.
44,Does the minimum spanning tree of a graph give the shortest distance between any 2 specified nodes?,No. The Minimal spanning tree assures that the total weight of the tree is kept at its minimum. But it doesn't mean that the distance between any two nodes involved in the minimum-spanning tree is minimum.
45,"Which is the simplest file structure? (Sequential, Indexed, Random)",Sequential is the simplest file structure.
46,Whether Linked List is linear or Non-linear data structure?,According to Access strategies Linked list is a linear one . According to Storage Linked List is a Non-linear one.
47,What is a Linear Data Structure? Name a few examples.,"A data structure is linear if all its elements or data items are arranged in a sequence or a linear order. The elements are stored in a non-hierarchical way so that each item has successors and predecessors except the first and last element in the list . Examples of linear data structures are Arrays, Stack, Strings, Queue, and Linked List."
48,What is the difference between file structure and storage structure?,"The difference lies in the memory area accessed. Storage structure refers to the data structure in the memory of the computer system, whereas file structure represents the storage structure in the auxiliary memory."
49,What is a multidimensional array?,A multidimensional array is a multidimensional array with more than one dimension. It is an array of arrays or an array with numerous layers. 
50,Are linked lists considered linear or non-linear Data Structures?,"Linked lists are considered both linear and non-linear data structures depending upon the application they are used for. When used for access strategies, it is considered as a linear data-structure. When used for data storage, it is considered a non-linear data structure."
51,What are the advantages of a linked list over an array? ,"Addition/Deletion of an element from the list at any index which is an O(1) operation in Lists as compared to Arrays."
52,What is a doubly-linked list?,"It is a complex type (double-ended LL) of a linked list in which a node has two links, one that connects to the next node in the sequence and another that connects to the previous node. This allows traversal across the data elements in both directions. "
53,How do you reference all of the elements in a one-dimension array?,"Using an indexed loop, we may access all of the elements in a one-dimensional array. The counter counts down from 0 to the maximum array size, n, minus one. The loop counter is used as the array subscript to refer to all items of the one-dimensional array in succession."
54,What is an algorithm? ,An algorithm is a step by step method of solving a problem or manipulating data. It defines a set of instructions to be executed in a certain order to get the desired output. 
55,Why do we need to do an algorithm analysis?,A problem can be solved in more than one way using several solution algorithms. Algorithm analysis provides an estimation of the required resources of an algorithm to solve a specific computational problem. The amount of time and space resources required to execute is also determined.
56, What is a stack?,"A stack is an abstract data type that specifies a linear data structure, as in a real physical stack or piles where you can only take the top item off the stack in order to remove things. Thus, insertion (push) and deletion (pop) of items take place only at one end called top of the stack, with a particular order: LIFO (Last In First Out) or FILO (First In Last Out)."
57,What is a queue Data Structure?,"In this data structure interview question, you can also discuss your experience and situations using queue. A queue is an abstract data type that specifies a linear data structure or an ordered list,  using the First In First Out (FIFO) operation to access elements. Insert operations can be performed only at one end called REAR and delete operations can be performed only at the other end called FRONT. "
58, What is a Dequeue?,"t is a double-ended queue, or a data structure, where the elements can be inserted or deleted at both ends (FRONT and REAR)"
59,What are the advantages of the heap over a stack?,Heap is more flexible than the stack because memory space can be dynamically allocated and de-allocated as needed
60,How to convert stack into queue,"To enqueue an item into the queue, first move all elements from the first stack to the second stack, push the item into the first stack, and finally move all elements back to the first stack. This ensures that the new item lies at the bottom of the stack and hence would be the last one to be removed."
61,What is DBMS?,"Data Base Management System is a collection of programs that facilitates users to create and maintain a database. DBMS provides us an interface or tool for performing different operations such as the creation of a database, inserting data into it, deleting data from it, updating the data, etc."
62,What is a database?,"A Database is a logical, consistent and organized collection of data that it can easily be accessed, managed and updated"
63,What is Database system?,The collection of database and DBMS software together is known as a database system
64,"What are the advantages of DBMS?","Redundancy control , Restriction for unauthorized access , Provides multiple user interfaces , Provides backup and recovery , Enforces integrity constraints , Ensure data consistency"
65,What is RDBMS?,RDBMS stands for Relational Database Management Systems. It is used to maintain the data records and indices in tables.
66,How many types of database languages are?,"There are four types of database languages, 1. Data Definition Language (DDL) 2. Data Manipulation Language (DML) 3. DATA Control Language (DCL) 4. Transaction Control Language (TCL)"
67,"What do you understand by Data Model?","The Data model is specified as a collection of conceptual tools for describing data, data relationships, data semantics and constraints. "
68,Define a Relation Schema and a Relation.,A Relation Schema is specified as a set of attributes. It is also known as table schema. It defines what the name of the table is. Relation schema is known as the blueprint with the help of which we can explain that how the data is organized into tables. This blueprint contains no data . A relation is specified as a set of tuples. A relation is the set of related attributes with identifying key attributes
69,What is the Relationship?,The Relationship is defined as an association among two or more entities. There are three type of relationships in DBMS One-To-One: Here one record of any object can be related to one record of another object . One-To-Many (many-to-one): Here one record of any object can be related to many records of other object and vice versa . Many-to-many: Here more than one records of an object can be related to n number of records of another object.
70,What are the disadvantages of file processing systems?,"Inconsistent , Not secure , Data redundancy , Difficult in accessing data , Data isolation"
71,What is data abstraction in DBMS?,"Data abstraction in DBMS is a process of hiding irrelevant details from users. Because database systems are made of complex data structures so, it makes accessible the user interaction with the database."
72,What is DDL (Data Definition Language)?,"Data Definition Language (DDL) is a standard for commands which defines the different structures in a database. Most commonly DDL statements are CREATE, ALTER, and DROP. These commands are used for updating data into the database."
73,What is DML (Data Manipulation Language)?,"Data Manipulation Language (DML) is a language that enables the user to access or manipulate data as organized by the appropriate data model. For example- SELECT, UPDATE, INSERT, DELETE."
74,What is normalization?,"Normalization is a process of analysing the given relation schemas according to their functional dependencies. It is used to minimize redundancy and also used to minimize insertion, deletion and update distractions."
75,What is Denormalization?,Denormalization is the process of boosting up database performance and adding of redundant data which helps to get rid of complex data
76,What is the E-R model?,E-R model is a short name for the Entity-Relationship model. This model is based on the real world. It contains necessary objects (known as entities) and the relationship among these objects.
77,What is an entity?,The Entity is a set of attributes in a database. An entity can be a real-world object which physically exists in this world. All the entities have their attribute which in the real world considered as the characteristics of the object.
78,What is Weak Entity set?,An entity set that doesn't have sufficient attributes to form a primary key is referred to as a weak entity set. 
79,What is an attribute?,An attribute refers to a database component. It is used to describe the property of an entity. An attribute can be defined as the characteristics of the entity.
80,What is Data Independence?,"Data independence specifies that ""the application is independent of the storage structure and access strategy of data."" It makes you able to modify the schema definition at one level without altering the schema definition in the next higher level."
81,Can you list the three levels of abstraction.,Following are three levels of data abstraction Physical level: It is the lowest level of abstraction. It describes how data are stored. Logical level: It is the next higher level of abstraction. It describes what data are stored in the database and what relationship among those data View level: It is the highest level of data abstraction. It describes only part of the entire database.
82,What is Join?,The Join operation is one of the most useful activities in relational algebra. It is most commonly used way to combine information from two or more relations. A Join is always performed on the basis of the same or related column. Most complex queries of SQL involve JOIN command.
83,What is 1NF?,1NF is the First Normal Form. It is the simplest type of normalization that you can implement in a database. The primary objectives of 1NF are to Every column must have atomic single value To Remove duplicate columns from the same table Create separate tables for each group of related data and identify each row with a unique column
84,What is 2NF?,"2NF is the Second Normal Form. A table is said to be 2NF if it follows the following conditions The table is in 1NF firstly it is necessary that the table should follow the rules of 1NF Every non-prime attribute is fully functionally dependent on the primary key  every non-key attribute should be dependent on the primary key in such a way that if any key element is deleted, then even the non_key element will still be saved in the database."
85,What is 3NF?,3NF stands for Third Normal Form. A database is called in 3NF if it satisfies the following conditions It is in second normal form There is no transitive functional dependency.
86,What is BCNF?,"BCNF stands for Boyce-Codd Normal Form. It is an advanced version of 3NF, so it is also referred to as 3.5NF. BCNF is stricter than 3NF A table complies with BCNF if it satisfies the following conditions It is in 3NF For every functional dependency X->Y, X should be the super key of the table. It merely means that X cannot be a non-prime attribute if Y is a prime attribute."
87,Explain ACID properties,"ACID properties are some basic rules, which has to be satisfied by every transaction to preserve the integrity. These properties and rules are ATOMICITY Atomicity is more generally known as ?all or nothing rule.' Which implies all are considered as one unit, and they either run to completion or not executed at all CONSISTENCY  This property refers to the uniformity of the data. Consistency implies that the database is consistent before and after the transaction . ISOLATION This property states that the number of the ransaction can be executed concurrently without leading to the inconsistency of the database state DURABILITY This property ensures that once the transaction is committed it will be stored in the non-volatile memory and system crash can also not affect it anymore."
88,What is 2-Tier architecture?,"The 2-Tier architecture is the same as basic client-server. In the two-tier architecture, applications on the client end can directly communicate with the database at the server side."
89,What is the 3-Tier architecture?,"The 3-Tier architecture contains another layer between the client and server. Introduction of 3-tier architecture is for the ease of the users as it provides the GUI, which, make the system secure and much more accessible. In this architecture, the application on the client-end interacts with an application on the server which further communicates with the database system"
90,Describe the types of keys?,"There are following types of keys Primary key The Primary key is an attribute in a table that can uniquely identify each record in a table. It is compulsory for every table Candidate key: The Candidate key is an attribute or set of an attribute which can uniquely identify a tuple. The Primary key can be selected from these attributes Super key The Super key is a set of attributes which can uniquely identify a tuple. Super key is a superset of the candidate key. Foreign key The Foreign key is a primary key from one table, which has a relationship with another table. It acts as a cross-reference between tables."
91,Explain the main purpose of an operating system?,Operating systems exist for two main purposes. One is that it is designed to make sure a computer system performs well by managing its computational activities. Another is that it provides an environment for the development and execution of programs.
92,What is demand paging?,"Demand paging is referred when not all of a process’s pages are in the RAM, then the OS brings the missing(and required) pages from the disk into the RAM."
